{
  "$schema": "http://json-schema.org/schema#",
  "type": "object",
  "properties": {
    "form_name": {
      "type": "string"
    },
    "form_names": {
      "type": "array"
    },
    "form_order": {
      "type": "integer"
    },
    "id": {
      "type": "integer"
    },
    "is_battle_only": {
      "type": "boolean"
    },
    "is_default": {
      "type": "boolean"
    },
    "is_mega": {
      "type": "boolean"
    },
    "name": {
      "type": "string"
    },
    "names": {
      "type": "array"
    },
    "order": {
      "type": "integer"
    },
    "pokemon": {
      "type": "object",
      "properties": {
        "name": {
          "type": "string"
        },
        "url": {
          "type": "string"
        }
      },
      "required": [
        "name",
        "url"
      ]
    },
    "sprites": {
      "type": "object",
      "properties": {
        "back_default": {
          "type": "string"
        },
        "back_female": {
          "type": "null"
        },
        "back_shiny": {
          "type": "string"
        },
        "back_shiny_female": {
          "type": "null"
        },
        "front_default": {
          "type": "string"
        },
        "front_female": {
          "type": "null"
        },
        "front_shiny": {
          "type": "string"
        },
        "front_shiny_female": {
          "type": "null"
        }
      },
      "required": [
        "back_default",
        "back_female",
        "back_shiny",
        "back_shiny_female",
        "front_default",
        "front_female",
        "front_shiny",
        "front_shiny_female"
      ]
    },
    "types": {
      "type": "array",
      "items": {
        "type": "object",
        "properties": {
          "slot": {
            "type": "integer"
          },
          "type": {
            "type": "object",
            "properties": {
              "name": {
                "type": "string"
              },
              "url": {
                "type": "string"
              }
            },
            "required": [
              "name",
              "url"
            ]
          }
        },
        "required": [
          "slot",
          "type"
        ]
      }
    },
    "version_group": {
      "type": "object",
      "properties": {
        "name": {
          "type": "string"
        },
        "url": {
          "type": "string"
        }
      },
      "required": [
        "name",
        "url"
      ]
    }
  },
  "required": [
    "form_name",
    "form_names",
    "form_order",
    "id",
    "is_battle_only",
    "is_default",
    "is_mega",
    "name",
    "names",
    "order",
    "pokemon",
    "sprites",
    "types",
    "version_group"
  ]
}
