{
    "form_name": "",
    "form_names": [],
    "form_order": 1,
    "id": 554,
    "is_battle_only": false,
    "is_default": true,
    "is_mega": false,
    "name": "darumaka",
    "names": [],
    "order": 706,
    "pokemon": {
        "name": "darumaka",
        "url": "https://pokeapi.co/api/v2/pokemon/554/"
    },
    "sprites": {
        "back_default": "https://raw.githubusercontent.com/PokeAPI/sprites/master/sprites/pokemon/back/554.png",
        "back_female": null,
        "back_shiny": "https://raw.githubusercontent.com/PokeAPI/sprites/master/sprites/pokemon/back/shiny/554.png",
        "back_shiny_female": null,
        "front_default": "https://raw.githubusercontent.com/PokeAPI/sprites/master/sprites/pokemon/554.png",
        "front_female": null,
        "front_shiny": "https://raw.githubusercontent.com/PokeAPI/sprites/master/sprites/pokemon/shiny/554.png",
        "front_shiny_female": null
    },
    "types": [
        {
            "slot": 1,
            "type": {
                "name": "fire",
                "url": "https://pokeapi.co/api/v2/type/10/"
            }
        }
    ],
    "version_group": {
        "name": "black-white",
        "url": "https://pokeapi.co/api/v2/version-group/11/"
    }
}