{
    "form_name": "sandy",
    "form_names": [
        {
            "language": {
                "name": "ja-Hrkt",
                "url": "https://pokeapi.co/api/v2/language/1/"
            },
            "name": "\u3059\u306a\u3061\u306e\u30df\u30ce"
        },
        {
            "language": {
                "name": "ko",
                "url": "https://pokeapi.co/api/v2/language/3/"
            },
            "name": "\ubaa8\ub798\ub545\ub3c4\ub871"
        },
        {
            "language": {
                "name": "zh-Hant",
                "url": "https://pokeapi.co/api/v2/language/4/"
            },
            "name": "\u7802\u571f\u84d1\u8863"
        },
        {
            "language": {
                "name": "fr",
                "url": "https://pokeapi.co/api/v2/language/5/"
            },
            "name": "Cape Sable"
        },
        {
            "language": {
                "name": "de",
                "url": "https://pokeapi.co/api/v2/language/6/"
            },
            "name": "Sandumhang"
        },
        {
            "language": {
                "name": "es",
                "url": "https://pokeapi.co/api/v2/language/7/"
            },
            "name": "Tronco Arena"
        },
        {
            "language": {
                "name": "it",
                "url": "https://pokeapi.co/api/v2/language/8/"
            },
            "name": "Manto Sabbia"
        },
        {
            "language": {
                "name": "en",
                "url": "https://pokeapi.co/api/v2/language/9/"
            },
            "name": "Sandy Cloak"
        },
        {
            "language": {
                "name": "ja",
                "url": "https://pokeapi.co/api/v2/language/11/"
            },
            "name": "\u3059\u306a\u3061\u306e\u30df\u30ce"
        },
        {
            "language": {
                "name": "zh-Hans",
                "url": "https://pokeapi.co/api/v2/language/12/"
            },
            "name": "\u7802\u571f\u84d1\u8863"
        }
    ],
    "form_order": 2,
    "id": 10036,
    "is_battle_only": false,
    "is_default": true,
    "is_mega": false,
    "name": "wormadam-sandy",
    "names": [
        {
            "language": {
                "name": "fr",
                "url": "https://pokeapi.co/api/v2/language/5/"
            },
            "name": "Cheniselle Sable"
        },
        {
            "language": {
                "name": "en",
                "url": "https://pokeapi.co/api/v2/language/9/"
            },
            "name": "Sandy Wormadam"
        }
    ],
    "order": 555,
    "pokemon": {
        "name": "wormadam-sandy",
        "url": "https://pokeapi.co/api/v2/pokemon/10004/"
    },
    "sprites": {
        "back_default": "https://raw.githubusercontent.com/PokeAPI/sprites/master/sprites/pokemon/back/413-sandy.png",
        "back_female": null,
        "back_shiny": "https://raw.githubusercontent.com/PokeAPI/sprites/master/sprites/pokemon/back/shiny/413-sandy.png",
        "back_shiny_female": null,
        "front_default": "https://raw.githubusercontent.com/PokeAPI/sprites/master/sprites/pokemon/10004.png",
        "front_female": null,
        "front_shiny": "https://raw.githubusercontent.com/PokeAPI/sprites/master/sprites/pokemon/shiny/413-sandy.png",
        "front_shiny_female": null
    },
    "types": [
        {
            "slot": 1,
            "type": {
                "name": "bug",
                "url": "https://pokeapi.co/api/v2/type/7/"
            }
        },
        {
            "slot": 2,
            "type": {
                "name": "ground",
                "url": "https://pokeapi.co/api/v2/type/5/"
            }
        }
    ],
    "version_group": {
        "name": "diamond-pearl",
        "url": "https://pokeapi.co/api/v2/version-group/8/"
    }
}