{
    "form_name": "rainy",
    "form_names": [
        {
            "language": {
                "name": "ja-Hrkt",
                "url": "https://pokeapi.co/api/v2/language/1/"
            },
            "name": "\u3042\u307e\u307f\u305a\u306e\u3059\u304c\u305f"
        },
        {
            "language": {
                "name": "ko",
                "url": "https://pokeapi.co/api/v2/language/3/"
            },
            "name": "\ube57\ubc29\uc6b8\uc758 \ubaa8\uc2b5"
        },
        {
            "language": {
                "name": "zh-Hant",
                "url": "https://pokeapi.co/api/v2/language/4/"
            },
            "name": "\u96e8\u6c34\u7684\u6a23\u5b50"
        },
        {
            "language": {
                "name": "fr",
                "url": "https://pokeapi.co/api/v2/language/5/"
            },
            "name": "Forme Eau de Pluie"
        },
        {
            "language": {
                "name": "de",
                "url": "https://pokeapi.co/api/v2/language/6/"
            },
            "name": "Regenform"
        },
        {
            "language": {
                "name": "es",
                "url": "https://pokeapi.co/api/v2/language/7/"
            },
            "name": "Forma Lluvia"
        },
        {
            "language": {
                "name": "it",
                "url": "https://pokeapi.co/api/v2/language/8/"
            },
            "name": "Forma Pioggia"
        },
        {
            "language": {
                "name": "en",
                "url": "https://pokeapi.co/api/v2/language/9/"
            },
            "name": "Rainy Form"
        },
        {
            "language": {
                "name": "ja",
                "url": "https://pokeapi.co/api/v2/language/11/"
            },
            "name": "\u3042\u307e\u307f\u305a\u306e\u3059\u304c\u305f"
        },
        {
            "language": {
                "name": "zh-Hans",
                "url": "https://pokeapi.co/api/v2/language/12/"
            },
            "name": "\u96e8\u6c34\u7684\u6837\u5b50"
        }
    ],
    "form_order": 3,
    "id": 10029,
    "is_battle_only": true,
    "is_default": true,
    "is_mega": false,
    "name": "castform-rainy",
    "names": [
        {
            "language": {
                "name": "fr",
                "url": "https://pokeapi.co/api/v2/language/5/"
            },
            "name": "Morph\u00e9o Eau de Pluie"
        },
        {
            "language": {
                "name": "en",
                "url": "https://pokeapi.co/api/v2/language/9/"
            },
            "name": "Rainy Castform"
        }
    ],
    "order": 476,
    "pokemon": {
        "name": "castform-rainy",
        "url": "https://pokeapi.co/api/v2/pokemon/10014/"
    },
    "sprites": {
        "back_default": "https://raw.githubusercontent.com/PokeAPI/sprites/master/sprites/pokemon/back/351-rainy.png",
        "back_female": null,
        "back_shiny": "https://raw.githubusercontent.com/PokeAPI/sprites/master/sprites/pokemon/back/shiny/10014.png",
        "back_shiny_female": null,
        "front_default": "https://raw.githubusercontent.com/PokeAPI/sprites/master/sprites/pokemon/10014.png",
        "front_female": null,
        "front_shiny": "https://raw.githubusercontent.com/PokeAPI/sprites/master/sprites/pokemon/shiny/10014.png",
        "front_shiny_female": null
    },
    "types": [
        {
            "slot": 1,
            "type": {
                "name": "water",
                "url": "https://pokeapi.co/api/v2/type/11/"
            }
        }
    ],
    "version_group": {
        "name": "ruby-sapphire",
        "url": "https://pokeapi.co/api/v2/version-group/5/"
    }
}