{
    "form_name": "complete",
    "form_names": [
        {
            "language": {
                "name": "ja-Hrkt",
                "url": "https://pokeapi.co/api/v2/language/1/"
            },
            "name": "\u30d1\u30fc\u30d5\u30a7\u30af\u30c8\u30d5\u30a9\u30eb\u30e0"
        },
        {
            "language": {
                "name": "ko",
                "url": "https://pokeapi.co/api/v2/language/3/"
            },
            "name": "\ud37c\ud399\ud2b8\ud3fc"
        },
        {
            "language": {
                "name": "zh-Hant",
                "url": "https://pokeapi.co/api/v2/language/4/"
            },
            "name": "\u5b8c\u5168\u9ad4\u5f62\u614b"
        },
        {
            "language": {
                "name": "fr",
                "url": "https://pokeapi.co/api/v2/language/5/"
            },
            "name": "Forme Parfaite"
        },
        {
            "language": {
                "name": "de",
                "url": "https://pokeapi.co/api/v2/language/6/"
            },
            "name": "Optimumform"
        },
        {
            "language": {
                "name": "es",
                "url": "https://pokeapi.co/api/v2/language/7/"
            },
            "name": "Forma Completa"
        },
        {
            "language": {
                "name": "it",
                "url": "https://pokeapi.co/api/v2/language/8/"
            },
            "name": "Forma Perfetta"
        },
        {
            "language": {
                "name": "en",
                "url": "https://pokeapi.co/api/v2/language/9/"
            },
            "name": "Complete Forme"
        },
        {
            "language": {
                "name": "ja",
                "url": "https://pokeapi.co/api/v2/language/11/"
            },
            "name": "\u30d1\u30fc\u30d5\u30a7\u30af\u30c8\u30d5\u30a9\u30eb\u30e0"
        },
        {
            "language": {
                "name": "zh-Hans",
                "url": "https://pokeapi.co/api/v2/language/12/"
            },
            "name": "\u5b8c\u5168\u4f53\u5f62\u6001"
        }
    ],
    "form_order": 4,
    "id": 10222,
    "is_battle_only": false,
    "is_default": true,
    "is_mega": false,
    "name": "zygarde-complete",
    "names": [
        {
            "language": {
                "name": "en",
                "url": "https://pokeapi.co/api/v2/language/9/"
            },
            "name": "Complete Zygarde"
        }
    ],
    "order": 980,
    "pokemon": {
        "name": "zygarde-complete",
        "url": "https://pokeapi.co/api/v2/pokemon/10120/"
    },
    "sprites": {
        "back_default": "https://raw.githubusercontent.com/PokeAPI/sprites/master/sprites/pokemon/back/10120.png",
        "back_female": null,
        "back_shiny": "https://raw.githubusercontent.com/PokeAPI/sprites/master/sprites/pokemon/back/shiny/10120.png",
        "back_shiny_female": null,
        "front_default": "https://raw.githubusercontent.com/PokeAPI/sprites/master/sprites/pokemon/10120.png",
        "front_female": null,
        "front_shiny": "https://raw.githubusercontent.com/PokeAPI/sprites/master/sprites/pokemon/shiny/10120.png",
        "front_shiny_female": null
    },
    "types": [
        {
            "slot": 1,
            "type": {
                "name": "dragon",
                "url": "https://pokeapi.co/api/v2/type/16/"
            }
        },
        {
            "slot": 2,
            "type": {
                "name": "ground",
                "url": "https://pokeapi.co/api/v2/type/5/"
            }
        }
    ],
    "version_group": {
        "name": "sun-moon",
        "url": "https://pokeapi.co/api/v2/version-group/17/"
    }
}