{
    "form_name": "altered",
    "form_names": [
        {
            "language": {
                "name": "ja-Hrkt",
                "url": "https://pokeapi.co/api/v2/language/1/"
            },
            "name": "\u30a2\u30ca\u30b6\u30fc\u30d5\u30a9\u30eb\u30e0"
        },
        {
            "language": {
                "name": "ko",
                "url": "https://pokeapi.co/api/v2/language/3/"
            },
            "name": "\uc5b4\ub098\ub354\ud3fc"
        },
        {
            "language": {
                "name": "zh-Hant",
                "url": "https://pokeapi.co/api/v2/language/4/"
            },
            "name": "\u5225\u7a2e\u5f62\u614b"
        },
        {
            "language": {
                "name": "fr",
                "url": "https://pokeapi.co/api/v2/language/5/"
            },
            "name": "Forme Alternative"
        },
        {
            "language": {
                "name": "de",
                "url": "https://pokeapi.co/api/v2/language/6/"
            },
            "name": "Wandelform"
        },
        {
            "language": {
                "name": "es",
                "url": "https://pokeapi.co/api/v2/language/7/"
            },
            "name": "Forma Modificada"
        },
        {
            "language": {
                "name": "it",
                "url": "https://pokeapi.co/api/v2/language/8/"
            },
            "name": "Forma Alterata"
        },
        {
            "language": {
                "name": "en",
                "url": "https://pokeapi.co/api/v2/language/9/"
            },
            "name": "Altered Forme"
        },
        {
            "language": {
                "name": "ja",
                "url": "https://pokeapi.co/api/v2/language/11/"
            },
            "name": "\u30a2\u30ca\u30b6\u30fc\u30d5\u30a9\u30eb\u30e0"
        },
        {
            "language": {
                "name": "zh-Hans",
                "url": "https://pokeapi.co/api/v2/language/12/"
            },
            "name": "\u522b\u79cd\u5f62\u6001"
        }
    ],
    "form_order": 1,
    "id": 487,
    "is_battle_only": false,
    "is_default": true,
    "is_mega": false,
    "name": "giratina-altered",
    "names": [
        {
            "language": {
                "name": "fr",
                "url": "https://pokeapi.co/api/v2/language/5/"
            },
            "name": "Giratina Alternative"
        },
        {
            "language": {
                "name": "en",
                "url": "https://pokeapi.co/api/v2/language/9/"
            },
            "name": "Altered Giratina"
        }
    ],
    "order": 617,
    "pokemon": {
        "name": "giratina-altered",
        "url": "https://pokeapi.co/api/v2/pokemon/487/"
    },
    "sprites": {
        "back_default": "https://raw.githubusercontent.com/PokeAPI/sprites/master/sprites/pokemon/back/487.png",
        "back_female": null,
        "back_shiny": "https://raw.githubusercontent.com/PokeAPI/sprites/master/sprites/pokemon/back/shiny/487.png",
        "back_shiny_female": null,
        "front_default": "https://raw.githubusercontent.com/PokeAPI/sprites/master/sprites/pokemon/487.png",
        "front_female": null,
        "front_shiny": "https://raw.githubusercontent.com/PokeAPI/sprites/master/sprites/pokemon/shiny/487.png",
        "front_shiny_female": null
    },
    "types": [
        {
            "slot": 1,
            "type": {
                "name": "ghost",
                "url": "https://pokeapi.co/api/v2/type/8/"
            }
        },
        {
            "slot": 2,
            "type": {
                "name": "dragon",
                "url": "https://pokeapi.co/api/v2/type/16/"
            }
        }
    ],
    "version_group": {
        "name": "diamond-pearl",
        "url": "https://pokeapi.co/api/v2/version-group/8/"
    }
}