{
    "form_name": "",
    "form_names": [],
    "form_order": 1,
    "id": 230,
    "is_battle_only": false,
    "is_default": true,
    "is_mega": false,
    "name": "kingdra",
    "names": [],
    "order": 179,
    "pokemon": {
        "name": "kingdra",
        "url": "https://pokeapi.co/api/v2/pokemon/230/"
    },
    "sprites": {
        "back_default": "https://raw.githubusercontent.com/PokeAPI/sprites/master/sprites/pokemon/back/230.png",
        "back_female": null,
        "back_shiny": "https://raw.githubusercontent.com/PokeAPI/sprites/master/sprites/pokemon/back/shiny/230.png",
        "back_shiny_female": null,
        "front_default": "https://raw.githubusercontent.com/PokeAPI/sprites/master/sprites/pokemon/230.png",
        "front_female": null,
        "front_shiny": "https://raw.githubusercontent.com/PokeAPI/sprites/master/sprites/pokemon/shiny/230.png",
        "front_shiny_female": null
    },
    "types": [
        {
            "slot": 1,
            "type": {
                "name": "water",
                "url": "https://pokeapi.co/api/v2/type/11/"
            }
        },
        {
            "slot": 2,
            "type": {
                "name": "dragon",
                "url": "https://pokeapi.co/api/v2/type/16/"
            }
        }
    ],
    "version_group": {
        "name": "gold-silver",
        "url": "https://pokeapi.co/api/v2/version-group/3/"
    }
}