{
    "form_name": "incarnate",
    "form_names": [
        {
            "language": {
                "name": "ja-Hrkt",
                "url": "https://pokeapi.co/api/v2/language/1/"
            },
            "name": "\u3051\u3057\u3093\u30d5\u30a9\u30eb\u30e0"
        },
        {
            "language": {
                "name": "ko",
                "url": "https://pokeapi.co/api/v2/language/3/"
            },
            "name": "\ud654\uc2e0\ud3fc"
        },
        {
            "language": {
                "name": "zh-Hant",
                "url": "https://pokeapi.co/api/v2/language/4/"
            },
            "name": "\u5316\u8eab\u5f62\u614b"
        },
        {
            "language": {
                "name": "fr",
                "url": "https://pokeapi.co/api/v2/language/5/"
            },
            "name": "Forme Avatar"
        },
        {
            "language": {
                "name": "de",
                "url": "https://pokeapi.co/api/v2/language/6/"
            },
            "name": "Inkarnationsform"
        },
        {
            "language": {
                "name": "es",
                "url": "https://pokeapi.co/api/v2/language/7/"
            },
            "name": "Forma Avatar"
        },
        {
            "language": {
                "name": "it",
                "url": "https://pokeapi.co/api/v2/language/8/"
            },
            "name": "Forma Incarnazione"
        },
        {
            "language": {
                "name": "en",
                "url": "https://pokeapi.co/api/v2/language/9/"
            },
            "name": "Incarnate Forme"
        },
        {
            "language": {
                "name": "ja",
                "url": "https://pokeapi.co/api/v2/language/11/"
            },
            "name": "\u3051\u3057\u3093\u30d5\u30a9\u30eb\u30e0"
        },
        {
            "language": {
                "name": "zh-Hans",
                "url": "https://pokeapi.co/api/v2/language/12/"
            },
            "name": "\u5316\u8eab\u5f62\u6001"
        }
    ],
    "form_order": 1,
    "id": 645,
    "is_battle_only": false,
    "is_default": true,
    "is_mega": false,
    "name": "landorus-incarnate",
    "names": [
        {
            "language": {
                "name": "fr",
                "url": "https://pokeapi.co/api/v2/language/5/"
            },
            "name": "D\u00e9m\u00e9t\u00e9ros Avatar"
        },
        {
            "language": {
                "name": "en",
                "url": "https://pokeapi.co/api/v2/language/9/"
            },
            "name": "Incarnate Landorus"
        }
    ],
    "order": 806,
    "pokemon": {
        "name": "landorus-incarnate",
        "url": "https://pokeapi.co/api/v2/pokemon/645/"
    },
    "sprites": {
        "back_default": "https://raw.githubusercontent.com/PokeAPI/sprites/master/sprites/pokemon/back/645.png",
        "back_female": null,
        "back_shiny": "https://raw.githubusercontent.com/PokeAPI/sprites/master/sprites/pokemon/back/shiny/645.png",
        "back_shiny_female": null,
        "front_default": "https://raw.githubusercontent.com/PokeAPI/sprites/master/sprites/pokemon/645.png",
        "front_female": null,
        "front_shiny": "https://raw.githubusercontent.com/PokeAPI/sprites/master/sprites/pokemon/shiny/645.png",
        "front_shiny_female": null
    },
    "types": [
        {
            "slot": 1,
            "type": {
                "name": "ground",
                "url": "https://pokeapi.co/api/v2/type/5/"
            }
        },
        {
            "slot": 2,
            "type": {
                "name": "flying",
                "url": "https://pokeapi.co/api/v2/type/3/"
            }
        }
    ],
    "version_group": {
        "name": "black-white",
        "url": "https://pokeapi.co/api/v2/version-group/11/"
    }
}