{
    "form_name": "",
    "form_names": [],
    "form_order": 1,
    "id": 783,
    "is_battle_only": false,
    "is_default": true,
    "is_mega": false,
    "name": "hakamo-o",
    "names": [],
    "order": 1094,
    "pokemon": {
        "name": "hakamo-o",
        "url": "https://pokeapi.co/api/v2/pokemon/783/"
    },
    "sprites": {
        "back_default": "https://raw.githubusercontent.com/PokeAPI/sprites/master/sprites/pokemon/back/783.png",
        "back_female": null,
        "back_shiny": "https://raw.githubusercontent.com/PokeAPI/sprites/master/sprites/pokemon/back/shiny/783.png",
        "back_shiny_female": null,
        "front_default": "https://raw.githubusercontent.com/PokeAPI/sprites/master/sprites/pokemon/783.png",
        "front_female": null,
        "front_shiny": "https://raw.githubusercontent.com/PokeAPI/sprites/master/sprites/pokemon/shiny/783.png",
        "front_shiny_female": null
    },
    "types": [
        {
            "slot": 1,
            "type": {
                "name": "dragon",
                "url": "https://pokeapi.co/api/v2/type/16/"
            }
        },
        {
            "slot": 2,
            "type": {
                "name": "fighting",
                "url": "https://pokeapi.co/api/v2/type/2/"
            }
        }
    ],
    "version_group": {
        "name": "sun-moon",
        "url": "https://pokeapi.co/api/v2/version-group/17/"
    }
}