{
    "form_name": "zen",
    "form_names": [
        {
            "language": {
                "name": "ja-Hrkt",
                "url": "https://pokeapi.co/api/v2/language/1/"
            },
            "name": "\u30c0\u30eb\u30de\u30e2\u30fc\u30c9"
        },
        {
            "language": {
                "name": "ko",
                "url": "https://pokeapi.co/api/v2/language/3/"
            },
            "name": "\ub2ec\ub9c8\ubaa8\ub4dc"
        },
        {
            "language": {
                "name": "zh-Hant",
                "url": "https://pokeapi.co/api/v2/language/4/"
            },
            "name": "\u9054\u6469\u6a21\u5f0f"
        },
        {
            "language": {
                "name": "fr",
                "url": "https://pokeapi.co/api/v2/language/5/"
            },
            "name": "Mode Transe"
        },
        {
            "language": {
                "name": "de",
                "url": "https://pokeapi.co/api/v2/language/6/"
            },
            "name": "Trance-Modus"
        },
        {
            "language": {
                "name": "es",
                "url": "https://pokeapi.co/api/v2/language/7/"
            },
            "name": "Modo Daruma"
        },
        {
            "language": {
                "name": "it",
                "url": "https://pokeapi.co/api/v2/language/8/"
            },
            "name": "Stato Zen"
        },
        {
            "language": {
                "name": "en",
                "url": "https://pokeapi.co/api/v2/language/9/"
            },
            "name": "Zen Mode"
        },
        {
            "language": {
                "name": "ja",
                "url": "https://pokeapi.co/api/v2/language/11/"
            },
            "name": "\u30c0\u30eb\u30de\u30e2\u30fc\u30c9"
        },
        {
            "language": {
                "name": "zh-Hans",
                "url": "https://pokeapi.co/api/v2/language/12/"
            },
            "name": "\u8fbe\u6469\u6a21\u5f0f"
        }
    ],
    "form_order": 2,
    "id": 10067,
    "is_battle_only": true,
    "is_default": true,
    "is_mega": false,
    "name": "darmanitan-zen",
    "names": [
        {
            "language": {
                "name": "fr",
                "url": "https://pokeapi.co/api/v2/language/5/"
            },
            "name": "Darumacho Transe"
        },
        {
            "language": {
                "name": "en",
                "url": "https://pokeapi.co/api/v2/language/9/"
            },
            "name": "Zen Darmanitan"
        }
    ],
    "order": 708,
    "pokemon": {
        "name": "darmanitan-zen",
        "url": "https://pokeapi.co/api/v2/pokemon/10017/"
    },
    "sprites": {
        "back_default": "https://raw.githubusercontent.com/PokeAPI/sprites/master/sprites/pokemon/back/555-zen.png",
        "back_female": null,
        "back_shiny": "https://raw.githubusercontent.com/PokeAPI/sprites/master/sprites/pokemon/back/shiny/555-zen.png",
        "back_shiny_female": null,
        "front_default": "https://raw.githubusercontent.com/PokeAPI/sprites/master/sprites/pokemon/10017.png",
        "front_female": null,
        "front_shiny": "https://raw.githubusercontent.com/PokeAPI/sprites/master/sprites/pokemon/shiny/555-zen.png",
        "front_shiny_female": null
    },
    "types": [
        {
            "slot": 1,
            "type": {
                "name": "fire",
                "url": "https://pokeapi.co/api/v2/type/10/"
            }
        },
        {
            "slot": 2,
            "type": {
                "name": "psychic",
                "url": "https://pokeapi.co/api/v2/type/14/"
            }
        }
    ],
    "version_group": {
        "name": "black-white",
        "url": "https://pokeapi.co/api/v2/version-group/11/"
    }
}