{
    "form_name": "10",
    "form_names": [
        {
            "language": {
                "name": "ja-Hrkt",
                "url": "https://pokeapi.co/api/v2/language/1/"
            },
            "name": "\uff11\uff10\uff05\u30d5\u30a9\u30eb\u30e0"
        },
        {
            "language": {
                "name": "ko",
                "url": "https://pokeapi.co/api/v2/language/3/"
            },
            "name": "10%\ud3fc"
        },
        {
            "language": {
                "name": "zh-Hant",
                "url": "https://pokeapi.co/api/v2/language/4/"
            },
            "name": "\uff11\uff10\uff05\u5f62\u614b"
        },
        {
            "language": {
                "name": "fr",
                "url": "https://pokeapi.co/api/v2/language/5/"
            },
            "name": "Forme 10 %"
        },
        {
            "language": {
                "name": "de",
                "url": "https://pokeapi.co/api/v2/language/6/"
            },
            "name": "10%-Form"
        },
        {
            "language": {
                "name": "es",
                "url": "https://pokeapi.co/api/v2/language/7/"
            },
            "name": "Forma 10%"
        },
        {
            "language": {
                "name": "it",
                "url": "https://pokeapi.co/api/v2/language/8/"
            },
            "name": "Forma 10%"
        },
        {
            "language": {
                "name": "en",
                "url": "https://pokeapi.co/api/v2/language/9/"
            },
            "name": "10% Forme"
        },
        {
            "language": {
                "name": "ja",
                "url": "https://pokeapi.co/api/v2/language/11/"
            },
            "name": "\uff11\uff10\uff05\u30d5\u30a9\u30eb\u30e0"
        },
        {
            "language": {
                "name": "zh-Hans",
                "url": "https://pokeapi.co/api/v2/language/12/"
            },
            "name": "\uff11\uff10\uff05\u5f62\u6001"
        }
    ],
    "form_order": 2,
    "id": 10220,
    "is_battle_only": false,
    "is_default": true,
    "is_mega": false,
    "name": "zygarde-10",
    "names": [
        {
            "language": {
                "name": "en",
                "url": "https://pokeapi.co/api/v2/language/9/"
            },
            "name": "10% Zygarde"
        }
    ],
    "order": 978,
    "pokemon": {
        "name": "zygarde-10",
        "url": "https://pokeapi.co/api/v2/pokemon/10118/"
    },
    "sprites": {
        "back_default": "https://raw.githubusercontent.com/PokeAPI/sprites/master/sprites/pokemon/back/10118.png",
        "back_female": null,
        "back_shiny": "https://raw.githubusercontent.com/PokeAPI/sprites/master/sprites/pokemon/back/shiny/10118.png",
        "back_shiny_female": null,
        "front_default": "https://raw.githubusercontent.com/PokeAPI/sprites/master/sprites/pokemon/10118.png",
        "front_female": null,
        "front_shiny": "https://raw.githubusercontent.com/PokeAPI/sprites/master/sprites/pokemon/shiny/10118.png",
        "front_shiny_female": null
    },
    "types": [
        {
            "slot": 1,
            "type": {
                "name": "dragon",
                "url": "https://pokeapi.co/api/v2/type/16/"
            }
        },
        {
            "slot": 2,
            "type": {
                "name": "ground",
                "url": "https://pokeapi.co/api/v2/type/5/"
            }
        }
    ],
    "version_group": {
        "name": "sun-moon",
        "url": "https://pokeapi.co/api/v2/version-group/17/"
    }
}