{
    "form_name": "midnight",
    "form_names": [
        {
            "language": {
                "name": "ja-Hrkt",
                "url": "https://pokeapi.co/api/v2/language/1/"
            },
            "name": "\u307e\u3088\u306a\u304b\u306e\u3059\u304c\u305f"
        },
        {
            "language": {
                "name": "ko",
                "url": "https://pokeapi.co/api/v2/language/3/"
            },
            "name": "\ud55c\ubc24\uc911\uc758 \ubaa8\uc2b5"
        },
        {
            "language": {
                "name": "zh-Hant",
                "url": "https://pokeapi.co/api/v2/language/4/"
            },
            "name": "\u9ed1\u591c\u7684\u6a23\u5b50"
        },
        {
            "language": {
                "name": "fr",
                "url": "https://pokeapi.co/api/v2/language/5/"
            },
            "name": "Forme Nocturne"
        },
        {
            "language": {
                "name": "de",
                "url": "https://pokeapi.co/api/v2/language/6/"
            },
            "name": "Nachtform"
        },
        {
            "language": {
                "name": "es",
                "url": "https://pokeapi.co/api/v2/language/7/"
            },
            "name": "Forma Nocturna"
        },
        {
            "language": {
                "name": "it",
                "url": "https://pokeapi.co/api/v2/language/8/"
            },
            "name": "Forma Notte"
        },
        {
            "language": {
                "name": "en",
                "url": "https://pokeapi.co/api/v2/language/9/"
            },
            "name": "Midnight Form"
        },
        {
            "language": {
                "name": "ja",
                "url": "https://pokeapi.co/api/v2/language/11/"
            },
            "name": "\u307e\u3088\u306a\u304b\u306e\u3059\u304c\u305f"
        },
        {
            "language": {
                "name": "zh-Hans",
                "url": "https://pokeapi.co/api/v2/language/12/"
            },
            "name": "\u9ed1\u591c\u7684\u6837\u5b50"
        }
    ],
    "form_order": 2,
    "id": 10228,
    "is_battle_only": false,
    "is_default": true,
    "is_mega": false,
    "name": "lycanroc-midnight",
    "names": [
        {
            "language": {
                "name": "en",
                "url": "https://pokeapi.co/api/v2/language/9/"
            },
            "name": "Midnight Lycanroc"
        }
    ],
    "order": 1017,
    "pokemon": {
        "name": "lycanroc-midnight",
        "url": "https://pokeapi.co/api/v2/pokemon/10126/"
    },
    "sprites": {
        "back_default": "https://raw.githubusercontent.com/PokeAPI/sprites/master/sprites/pokemon/back/10126.png",
        "back_female": null,
        "back_shiny": "https://raw.githubusercontent.com/PokeAPI/sprites/master/sprites/pokemon/back/shiny/10126.png",
        "back_shiny_female": null,
        "front_default": "https://raw.githubusercontent.com/PokeAPI/sprites/master/sprites/pokemon/10126.png",
        "front_female": null,
        "front_shiny": "https://raw.githubusercontent.com/PokeAPI/sprites/master/sprites/pokemon/shiny/10126.png",
        "front_shiny_female": null
    },
    "types": [
        {
            "slot": 1,
            "type": {
                "name": "rock",
                "url": "https://pokeapi.co/api/v2/type/6/"
            }
        }
    ],
    "version_group": {
        "name": "sun-moon",
        "url": "https://pokeapi.co/api/v2/version-group/17/"
    }
}